review_id,review
1,"Love the clean layout and how quickly everything loads."
2,"Great idea but the onboarding steps felt confusing at first."
3,"I use this every day to track my routines and reminders."
4,"Notifications are helpful without being too annoying or frequent."
5,"The latest update fixed bugs and made scrolling much smoother."
6,"Search works well, but filters could be more detailed."
7,"I like the dark mode and the readable font sizes."
8,"Please add an export option for my weekly progress data."
9,"The app crashes sometimes when I upload a large photo."
10,"Simple interface, strong functionality, and very little learning curve."
11,"I finished setup in minutes and started using it right away."
12,"The free version is solid, though premium feels expensive."
13,"Customer support replied quickly and solved my issue politely."
14,"Sync between phone and tablet has been reliable so far."
15,"I wish there were more color themes and icon choices."
16,"Performance is fast even when my internet connection is weak."
17,"This app helped me stay organized during a busy semester."
18,"Some buttons are too small and hard to tap accurately."
19,"Great for beginners who want straightforward tools without clutter."
20,"I had trouble resetting my password from the profile screen."
21,"The tutorial videos were clear and easy to follow."
22,"Data visualizations are useful, especially the weekly trend chart."
23,"I appreciate the accessibility options and larger text settings."
24,"Offline mode works, but syncing later can take a while."
25,"The calendar view is excellent for planning upcoming tasks."
26,"Please let users customize notification sounds and vibration patterns."
27,"I accidentally deleted an item and could not undo it."
28,"The app feels polished and professional compared to competitors."
29,"Loading times improved a lot after the recent patch."
30,"I would recommend this to classmates managing group projects."
31,"Sharing reports with teammates is quick and convenient."
32,"The sign in process should support more authentication options."
33,"I like how the dashboard summarizes my activity clearly."
34,"Sometimes the keyboard covers input fields on smaller screens."
35,"The help center articles answered most of my questions."
36,"Great app overall, but there are occasional lag spikes."
37,"I enjoy the progress badges because they keep me motivated."
38,"Please add reminders based on location and time together."
39,"Setup was intuitive and I did not need instructions."
40,"The app drains battery faster than my other tools."
41,"I can quickly find past entries using the search bar."
42,"Collaboration features are useful for team based assignments."
43,"I wish charts had labels that were easier to read."
44,"This app has made my workflow much more consistent."
45,"Push notifications stopped working after I changed phone settings."
46,"The typography and spacing make content comfortable to scan."
47,"I like that I can reorder tasks with drag and drop."
48,"Exported files opened correctly and matched what I expected."
49,"It would help to have keyboard shortcuts on desktop."
50,"Overall, this is dependable and worth using every week."
